{
  "schema_version": "2.3",
  "virtual_artifact_id": "efva_01J00000000000000000000017",
  "project_id": "efp_01J00000000000000000000001",
  "workflow_occurrence_id": "efw_01J00000000000000000000014",
  "generation_event_ref": "chat:conversation-4:turn-31:artifact-1",
  "display_name": "Workflow draft",
  "media_type": "text/markdown",
  "parent_refs": [
    "tree:eft_01J00000000000000000000004"
  ],
  "availability": "materialized",
  "materialization_event_refs": [
    "efme_01J00000000000000000000018"
  ],
  "created_at": "2026-07-15T12:08:30Z"
}
